{
  "schema_version": 1,
  "generated_at": "2026-02-15T12:32:53Z",
  "repository": "njfio/Tau",
  "schema_path": "/Users/n/RustroverProjects/rust_pi_issue1741/tasks/schemas/m21-validation-matrix.schema.json",
  "milestone": {
    "number": 21,
    "title": "Gap Closure Wave 2026-03: Structural Runtime Hardening",
    "state": "open",
    "open_issues": 78,
    "closed_issues": 10,
    "due_on": "2026-03-30T00:00:00Z"
  },
  "summary": {
    "total_issues": 88,
    "open_issues": 78,
    "closed_issues": 10,
    "completion_percent": 11.36,
    "epics": 3,
    "stories": 12,
    "tasks": 73,
    "with_comments": 11,
    "testing_matrix_required": 88,
    "testing_matrix_closed": 10,
    "local_artifacts_total": 6
  },
  "local_artifacts": [
    {
      "path": "/Users/n/RustroverProjects/rust_pi_issue1741/tasks/reports/m21-validation-matrix.json",
      "name": "m21-validation-matrix.json",
      "bytes": 48225,
      "modified_at": "2026-02-15T12:32:30Z",
      "status": "present"
    },
    {
      "path": "/Users/n/RustroverProjects/rust_pi_issue1741/tasks/reports/m21-validation-matrix.md",
      "name": "m21-validation-matrix.md",
      "bytes": 9729,
      "modified_at": "2026-02-15T12:32:30Z",
      "status": "present"
    },
    {
      "path": "/Users/n/RustroverProjects/rust_pi_issue1741/tasks/reports/pr-throughput-baseline.json",
      "name": "pr-throughput-baseline.json",
      "bytes": 22890,
      "modified_at": "2026-02-15T12:29:27Z",
      "status": "present"
    },
    {
      "path": "/Users/n/RustroverProjects/rust_pi_issue1741/tasks/reports/pr-throughput-baseline.md",
      "name": "pr-throughput-baseline.md",
      "bytes": 6515,
      "modified_at": "2026-02-15T12:29:27Z",
      "status": "present"
    },
    {
      "path": "/Users/n/RustroverProjects/rust_pi_issue1741/tasks/reports/pr-throughput-delta.json",
      "name": "pr-throughput-delta.json",
      "bytes": 2533,
      "modified_at": "2026-02-15T12:29:27Z",
      "status": "present"
    },
    {
      "path": "/Users/n/RustroverProjects/rust_pi_issue1741/tasks/reports/pr-throughput-delta.md",
      "name": "pr-throughput-delta.md",
      "bytes": 1285,
      "modified_at": "2026-02-15T12:29:27Z",
      "status": "present"
    }
  ],
  "issues": [
    {
      "number": 1605,
      "title": "Epic: Merge or Remove Scaffold Crates (Current-State Audit + Execution)",
      "state": "open",
      "url": "https://github.com/njfio/Tau/issues/1605",
      "labels": [
        "area:memory",
        "area:runtime",
        "area:tools",
        "enhancement",
        "epic",
        "roadmap",
        "testing-matrix"
      ],
      "type": "epic",
      "comments": 0,
      "has_comments": false,
      "testing_matrix_required": true,
      "parent_issue_url": "https://api.github.com/repos/njfio/Tau/issues/1678"
    },
    {
      "number": 1606,
      "title": "Epic: Split tools.rs and 10 Other Oversized Production Files",
      "state": "open",
      "url": "https://github.com/njfio/Tau/issues/1606",
      "labels": [
        "area:cli",
        "area:runtime",
        "area:tools",
        "enhancement",
        "epic",
        "roadmap",
        "testing-matrix"
      ],
      "type": "epic",
      "comments": 0,
      "has_comments": false,
      "testing_matrix_required": true,
      "parent_issue_url": "https://api.github.com/repos/njfio/Tau/issues/1678"
    },
    {
      "number": 1607,
      "title": "Epic: Merge tau-safety to Mainline Runtime Enforcement",
      "state": "open",
      "url": "https://github.com/njfio/Tau/issues/1607",
      "labels": [
        "area:providers",
        "area:runtime",
        "area:tools",
        "enhancement",
        "epic",
        "roadmap",
        "testing-matrix"
      ],
      "type": "epic",
      "comments": 0,
      "has_comments": false,
      "testing_matrix_required": true,
      "parent_issue_url": "https://api.github.com/repos/njfio/Tau/issues/1678"
    },
    {
      "number": 1610,
      "title": "Story: Scaffold-Crate Inventory and Merge/Remove Decision Matrix",
      "state": "open",
      "url": "https://github.com/njfio/Tau/issues/1610",
      "labels": [
        "area:runtime",
        "roadmap",
        "story",
        "testing-matrix"
      ],
      "type": "story",
      "comments": 0,
      "has_comments": false,
      "testing_matrix_required": true,
      "parent_issue_url": "https://api.github.com/repos/njfio/Tau/issues/1605"
    },
    {
      "number": 1611,
      "title": "Story: Execute Scaffold Merge/Remove Decisions Across Runtime Crates",
      "state": "open",
      "url": "https://github.com/njfio/Tau/issues/1611",
      "labels": [
        "area:memory",
        "area:runtime",
        "roadmap",
        "story",
        "testing-matrix"
      ],
      "type": "story",
      "comments": 0,
      "has_comments": false,
      "testing_matrix_required": true,
      "parent_issue_url": "https://api.github.com/repos/njfio/Tau/issues/1605"
    },
    {
      "number": 1612,
      "title": "Story: Live Validation and Rollout Hardening After Scaffold Consolidation",
      "state": "open",
      "url": "https://github.com/njfio/Tau/issues/1612",
      "labels": [
        "area:observability",
        "area:runtime",
        "roadmap",
        "story",
        "testing-matrix"
      ],
      "type": "story",
      "comments": 0,
      "has_comments": false,
      "testing_matrix_required": true,
      "parent_issue_url": "https://api.github.com/repos/njfio/Tau/issues/1605"
    },
    {
      "number": 1613,
      "title": "Story: Split `tau-tools/src/tools.rs` Below Maintainability Budget",
      "state": "open",
      "url": "https://github.com/njfio/Tau/issues/1613",
      "labels": [
        "area:runtime",
        "area:tools",
        "roadmap",
        "story",
        "testing-matrix"
      ],
      "type": "story",
      "comments": 0,
      "has_comments": false,
      "testing_matrix_required": true,
      "parent_issue_url": "https://api.github.com/repos/njfio/Tau/issues/1606"
    },
    {
      "number": 1614,
      "title": "Story: Split Oversized Production Files Cohort A (Files 2-6)",
      "state": "open",
      "url": "https://github.com/njfio/Tau/issues/1614",
      "labels": [
        "area:cli",
        "area:runtime",
        "roadmap",
        "story",
        "testing-matrix"
      ],
      "type": "story",
      "comments": 0,
      "has_comments": false,
      "testing_matrix_required": true,
      "parent_issue_url": "https://api.github.com/repos/njfio/Tau/issues/1606"
    },
    {
      "number": 1615,
      "title": "Story: Split Oversized Production Files Cohort B (Files 7-11) + File-Size Guardrails",
      "state": "open",
      "url": "https://github.com/njfio/Tau/issues/1615",
      "labels": [
        "area:ci-cd",
        "area:runtime",
        "roadmap",
        "story",
        "testing-matrix"
      ],
      "type": "story",
      "comments": 0,
      "has_comments": false,
      "testing_matrix_required": true,
      "parent_issue_url": "https://api.github.com/repos/njfio/Tau/issues/1606"
    },
    {
      "number": 1616,
      "title": "Story: Wire `tau-safety` Policy into Mainline Startup and Runtime Context",
      "state": "open",
      "url": "https://github.com/njfio/Tau/issues/1616",
      "labels": [
        "area:runtime",
        "area:tools",
        "roadmap",
        "story",
        "testing-matrix"
      ],
      "type": "story",
      "comments": 0,
      "has_comments": false,
      "testing_matrix_required": true,
      "parent_issue_url": "https://api.github.com/repos/njfio/Tau/issues/1607"
    },
    {
      "number": 1617,
      "title": "Story: Enforce Safety Scanning Across Inbound, Tool Output, and Outbound Payload Paths",
      "state": "open",
      "url": "https://github.com/njfio/Tau/issues/1617",
      "labels": [
        "area:providers",
        "area:runtime",
        "area:tools",
        "roadmap",
        "story",
        "testing-matrix"
      ],
      "type": "story",
      "comments": 0,
      "has_comments": false,
      "testing_matrix_required": true,
      "parent_issue_url": "https://api.github.com/repos/njfio/Tau/issues/1607"
    },
    {
      "number": 1618,
      "title": "Story: Safety Observability, Operator Diagnostics, and Live-Run Proofs",
      "state": "open",
      "url": "https://github.com/njfio/Tau/issues/1618",
      "labels": [
        "area:observability",
        "area:runtime",
        "roadmap",
        "story",
        "testing-matrix"
      ],
      "type": "story",
      "comments": 0,
      "has_comments": false,
      "testing_matrix_required": true,
      "parent_issue_url": "https://api.github.com/repos/njfio/Tau/issues/1607"
    },
    {
      "number": 1626,
      "title": "Task: Build scaffold inventory script and ownership map",
      "state": "open",
      "url": "https://github.com/njfio/Tau/issues/1626",
      "labels": [
        "area:runtime",
        "roadmap",
        "task",
        "testing-matrix"
      ],
      "type": "task",
      "comments": 0,
      "has_comments": false,
      "testing_matrix_required": true,
      "parent_issue_url": "https://api.github.com/repos/njfio/Tau/issues/1610"
    },
    {
      "number": 1627,
      "title": "Task: Publish merge/remove decision rubric and scoring sheet",
      "state": "open",
      "url": "https://github.com/njfio/Tau/issues/1627",
      "labels": [
        "area:runtime",
        "roadmap",
        "task",
        "testing-matrix"
      ],
      "type": "task",
      "comments": 0,
      "has_comments": false,
      "testing_matrix_required": true,
      "parent_issue_url": "https://api.github.com/repos/njfio/Tau/issues/1610"
    },
    {
      "number": 1628,
      "title": "Task: Consolidate or justify retention of training micro-crates",
      "state": "open",
      "url": "https://github.com/njfio/Tau/issues/1628",
      "labels": [
        "area:runtime",
        "roadmap",